information_class,target_property,empirical_verdict,evidence_boundary
I0_random_or_tie,source_good_localization,insufficient,random tie around C52/C55 baseline
I1_strict_source_observables,source_good_localization,insufficient,C42/C43 below reliability gates
I2_source_plus_target_or_trajectory_keys,residual_gauge_closure,insufficient,C52 best key-only remains below diagnostic label closure
I3_target_unlabeled_transductive_geometry,residual_gauge_closure,insufficient,C52 target-unlabeled geometry does not close gap
I4_target_grouped_zero_label_structure,local_diagnostic_ceiling,diagnostic_only,C48-C50 ceiling fragments and underuse persists
I5_few_label_or_split_label_calibration,future_actionability,not_established,split-label budget unavailable
I6_target_label_diagnostic_content,diagnostic_closure,sufficient_diagnostic,C52-C53
I7_same_label_endpoint_oracle,endpoint_closure,tautological_diagnostic,C54-C55
