source_id,authors,year,title,venue_or_publisher,doi_or_isbn,primary_url,review_scope,source_verified,citation_substitutes_for_project_proof
V01,David Blackwell,1953,Equivalent Comparisons of Experiments,Annals of Mathematical Statistics,10.1214/aoms/1177729032,https://projecteuclid.org/journals/annals-of-mathematical-statistics/volume-24/issue-2/Equivalent-Comparisons-of-Experiments/10.1214/aoms/1177729032.full,Blackwell comparison and state-independent garbling,1,0
V02,Lucien Le Cam,1986,Asymptotic Methods in Statistical Decision Theory,Springer,10.1007/978-1-4612-4946-7,https://link.springer.com/book/10.1007/978-1-4612-4946-7,experiments randomized decision kernels deficiency and testing lower bounds,1,0
V03,Bin Yu,1997,"Assouad, Fano, and Le Cam",Springer Festschrift for Lucien Le Cam,10.1007/978-1-4612-1880-7_29,https://doi.org/10.1007/978-1-4612-1880-7_29,finite minimax lower-bound reductions and constants,1,0
V04,Robert M. Fano,1961,Transmission of Information: A Statistical Theory of Communications,MIT Press,ISBN 9780262060011,https://mitpress.mit.edu/9780262561693/transmission-of-information/,Fano inequality attribution and logarithm conventions,1,0
V05,Yuhong Yang and Andrew Barron,1999,Information-Theoretic Determination of Minimax Rates of Convergence,Annals of Statistics,10.1214/aos/1017939142,https://projecteuclid.org/journals/annals-of-statistics/volume-27/issue-5/Information-theoretic-determination-of-minimax-rates-of-convergence/10.1214/aos/1017939142.full,information-theoretic minimax lower bounds and mixture KL identity context,1,0
V06,R. Tyrrell Rockafellar and Stanislav Uryasev,2002,Conditional Value-at-Risk for General Loss Distributions,Journal of Banking and Finance,10.1016/S0378-4266(02)00271-6,https://sites.math.washington.edu/~rtr/papers/rtr187-CVaR2.pdf,upper-loss CVaR for discrete and general loss distributions,1,0
