level,content_type,available,hit,gap_to_l7,closed_fraction_from_key_only,weak_close,strong_close,near_or_exceeds_l7,key_only,diagnostic_label_content,same_label_diagnostic,split_label_evaluated,candidate_specific_label_content,comparison_source,interpretation,target_labels_diagnostic_only,no_selection_artifact
L0_random_tie,trajectory random tie,1,0.429723378036041,0.38303382361004945,-0.1781926473068613,0,0,0,1,0,0,0,0,C52 trajectory random tie,No row-specific information inside trajectory cells.,0,1
L1_strict_source,best strict source score,1,0.5061728395061729,0.3065843621399176,0.05696202531645579,0,0,0,0,0,0,0,0,C52 best strict source,Best strict source score remains below label-derived diagnostics.,0,1
L2_key_only,best C52 key-only/source-geometry baseline,1,0.4876543209876543,0.3251028806584361,0.0,0,0,0,1,0,0,0,0,C52 best key-only,Best non-label key-only baseline from C52.,0,1
L3_cell_prior_label_content,cell base-rate label prior,1,0.429723378036041,0.38303382361004945,-0.1781926473068613,0,0,0,0,1,1,0,0,same-cell label base rate,Cell prior is label-derived but constant inside a trajectory cell.,1,1
L4_scalar_endpoint_label_content,candidate scalar endpoint label: target_joint_margin_raw:high,1,0.9444444444444444,-0.13168724279835398,1.4050632911392409,1,1,1,0,1,1,0,1,target_joint_margin_raw:high,Candidate-specific scalar endpoint label content closes the C52 gap.,1,1
L5_class_conditioned_label_content,candidate class-conditioned target label content,0,,,,0,0,0,0,1,1,0,1,not_available_candidate_level,Only aggregate class-conditioned mechanism tables are available; no C52 cell-level candidate table exists.,1,1
L6_pairwise_or_rank_label_content,within-cell rank of target_joint_margin_raw,1,0.9444444444444444,-0.13168724279835398,1.4050632911392409,1,1,1,0,1,1,0,1,rank(target_joint_margin_raw),"Within-cell scalar endpoint rank also closes the gap, but it is same-label diagnostic content.",1,1
L7_full_trajectory_centered_diagnostic,C52 trajectory-centered diagnostic control,1,0.8127572016460904,0.0,1.0,1,1,1,0,1,1,0,1,C52 trajectory-centered diagnostic,The C52 closing diagnostic control used target labels inside trajectory cells.,1,1
